{
  "contract_version": "1.0",
  "task_id": "task-verify-refs-02",
  "project_id": "literature-review-micp",
  "request": "核验这批引用的 DOI 是否真实且元数据一致, 标记疑似伪造的引用",
  "action": "doi.verify",
  "candidate_dois": [
    "10.1016/j.bgtech.2023.100002",
    "10.1139/cgj-2012-0023",
    "10.9999/fake.biocement.2024.00001"
  ],
  "claimed_metadata": {
    "10.1016/j.bgtech.2023.100002": {
      "title": "Microbially induced carbonate precipitation (MICP) for soil strengthening: A comprehensive review",
      "year": 2023
    },
    "10.1139/cgj-2012-0023": {
      "title": "Cementation of sand soil by microbially induced calcite precipitation at various degrees of saturation",
      "year": 2013
    }
  },
  "human_approval_state": {
    "granted": true,
    "approver": "obsidian-controller"
  },
  "actor": {"role": "controller", "id": "obsidian-router"},
  "skill_version": "1.0.0",
  "controller_version": "1.0",
  "timestamp": "2026-08-06T12:00:00Z"
}
